{
  "fields": {
    "alo.fit_nu": {
      "current": 1e-10,
      "locked": true,
      "margin_high": null,
      "margin_low": null,
      "measured": null,
      "oracle_error": null,
      "proposed": null,
      "reason": "no recorded spread",
      "samples": 0,
      "worst_variant": null
    },
    "alo.fit_rel": {
      "current": 1e-12,
      "locked": true,
      "margin_high": null,
      "margin_low": null,
      "measured": null,
      "oracle_error": null,
      "proposed": null,
      "reason": "no recorded spread",
      "samples": 0,
      "worst_variant": null
    },
    "alo.flat_vega": {
      "current": 1e-12,
      "locked": true,
      "margin_high": null,
      "margin_low": null,
      "measured": null,
      "oracle_error": null,
      "proposed": null,
      "reason": "no recorded spread",
      "samples": 0,
      "worst_variant": null
    },
    "alo.greek_abs": {
      "current": 1e-09,
      "locked": true,
      "margin_high": 0.2833389566461324,
      "margin_low": null,
      "measured": 0.0,
      "oracle_error": 2.833389566461324e-10,
      "proposed": 1e-09,
      "reason": null,
      "samples": 15036,
      "worst_variant": "c-serial-inproc-warm-all"
    },
    "alo.greek_rel": {
      "current": 1e-06,
      "locked": true,
      "margin_high": 0.2833389566461324,
      "margin_low": null,
      "measured": 0.0,
      "oracle_error": 2.8333895664613237e-07,
      "proposed": 1e-06,
      "reason": null,
      "samples": 15036,
      "worst_variant": "c-serial-inproc-warm-all"
    },
    "alo.iv_abs": {
      "current": 1e-08,
      "locked": true,
      "margin_high": 1.0,
      "margin_low": null,
      "measured": 0.0,
      "oracle_error": 1e-08,
      "proposed": 1e-08,
      "reason": null,
      "samples": 15036,
      "worst_variant": "c-serial-inproc-warm-all"
    },
    "alo.iv_ulp_rel": {
      "current": 1e-13,
      "locked": true,
      "margin_high": 1.0,
      "margin_low": null,
      "measured": 0.0,
      "oracle_error": 1e-13,
      "proposed": 1e-13,
      "reason": null,
      "samples": 15036,
      "worst_variant": "c-serial-inproc-warm-all"
    },
    "alo.price_rel": {
      "current": 1e-12,
      "locked": true,
      "margin_high": null,
      "margin_low": null,
      "measured": null,
      "oracle_error": null,
      "proposed": null,
      "reason": "no recorded spread",
      "samples": 0,
      "worst_variant": null
    },
    "ambiguity_rel": {
      "current": 1e-09,
      "locked": false,
      "margin_high": null,
      "margin_low": null,
      "measured": null,
      "oracle_error": null,
      "proposed": null,
      "reason": "no recorded spread",
      "samples": 0,
      "worst_variant": null
    },
    "baw.fit_nu": {
      "current": 1e-10,
      "locked": true,
      "margin_high": null,
      "margin_low": null,
      "measured": null,
      "oracle_error": null,
      "proposed": null,
      "reason": "no recorded spread",
      "samples": 0,
      "worst_variant": null
    },
    "baw.fit_rel": {
      "current": 1e-12,
      "locked": true,
      "margin_high": null,
      "margin_low": null,
      "measured": null,
      "oracle_error": null,
      "proposed": null,
      "reason": "no recorded spread",
      "samples": 0,
      "worst_variant": null
    },
    "baw.flat_vega": {
      "current": 1e-12,
      "locked": true,
      "margin_high": null,
      "margin_low": null,
      "measured": null,
      "oracle_error": null,
      "proposed": null,
      "reason": "no recorded spread",
      "samples": 0,
      "worst_variant": null
    },
    "baw.greek_abs": {
      "current": 1e-09,
      "locked": true,
      "margin_high": 0.0961534152247127,
      "margin_low": null,
      "measured": 0.0,
      "oracle_error": 9.61534152247127e-11,
      "proposed": 1e-09,
      "reason": null,
      "samples": 14994,
      "worst_variant": "c-serial-inproc-warm-all"
    },
    "baw.greek_rel": {
      "current": 1e-06,
      "locked": true,
      "margin_high": 0.0961534152247127,
      "margin_low": null,
      "measured": 0.0,
      "oracle_error": 9.615341522471269e-08,
      "proposed": 1e-06,
      "reason": null,
      "samples": 14994,
      "worst_variant": "c-serial-inproc-warm-all"
    },
    "baw.iv_abs": {
      "current": 1e-08,
      "locked": true,
      "margin_high": 1.0,
      "margin_low": null,
      "measured": 0.0,
      "oracle_error": 1e-08,
      "proposed": 1e-08,
      "reason": null,
      "samples": 14994,
      "worst_variant": "c-serial-inproc-warm-all"
    },
    "baw.iv_ulp_rel": {
      "current": 1e-13,
      "locked": true,
      "margin_high": 1.0,
      "margin_low": null,
      "measured": 0.0,
      "oracle_error": 1e-13,
      "proposed": 1e-13,
      "reason": null,
      "samples": 14994,
      "worst_variant": "c-serial-inproc-warm-all"
    },
    "baw.price_rel": {
      "current": 1e-12,
      "locked": true,
      "margin_high": null,
      "margin_low": null,
      "measured": null,
      "oracle_error": null,
      "proposed": null,
      "reason": "no recorded spread",
      "samples": 0,
      "worst_variant": null
    },
    "baw.sstar_k.delta": {
      "current": 0,
      "locked": true,
      "margin_high": null,
      "margin_low": null,
      "measured": null,
      "oracle_error": null,
      "proposed": null,
      "reason": "no recorded spread",
      "samples": 0,
      "worst_variant": null
    },
    "baw.sstar_k.gamma": {
      "current": 0,
      "locked": true,
      "margin_high": null,
      "margin_low": null,
      "measured": null,
      "oracle_error": null,
      "proposed": null,
      "reason": "no recorded spread",
      "samples": 0,
      "worst_variant": null
    },
    "baw.sstar_k.rho": {
      "current": 0,
      "locked": true,
      "margin_high": null,
      "margin_low": null,
      "measured": null,
      "oracle_error": null,
      "proposed": null,
      "reason": "no recorded spread",
      "samples": 0,
      "worst_variant": null
    },
    "baw.sstar_k.theta": {
      "current": 0,
      "locked": true,
      "margin_high": null,
      "margin_low": null,
      "measured": null,
      "oracle_error": null,
      "proposed": null,
      "reason": "no recorded spread",
      "samples": 0,
      "worst_variant": null
    },
    "baw.sstar_k.vega": {
      "current": 0,
      "locked": true,
      "margin_high": null,
      "margin_low": null,
      "measured": null,
      "oracle_error": null,
      "proposed": null,
      "reason": "no recorded spread",
      "samples": 0,
      "worst_variant": null
    },
    "fit_nu": {
      "current": 1e-10,
      "locked": false,
      "margin_high": null,
      "margin_low": null,
      "measured": null,
      "oracle_error": null,
      "proposed": null,
      "reason": "no recorded spread",
      "samples": 0,
      "worst_variant": null
    },
    "fit_rel": {
      "current": 1e-12,
      "locked": false,
      "margin_high": null,
      "margin_low": null,
      "measured": null,
      "oracle_error": null,
      "proposed": null,
      "reason": "no recorded spread",
      "samples": 0,
      "worst_variant": null
    },
    "flat_vega": {
      "current": 1e-12,
      "locked": false,
      "margin_high": null,
      "margin_low": null,
      "measured": null,
      "oracle_error": null,
      "proposed": null,
      "reason": "no recorded spread",
      "samples": 0,
      "worst_variant": null
    },
    "greek_abs": {
      "current": 1e-09,
      "locked": false,
      "margin_high": null,
      "margin_low": null,
      "measured": 1.2430476230398563e-17,
      "oracle_error": 1.432267629550188e-13,
      "proposed": null,
      "reason": "current value reaches the oracle error bound",
      "samples": 46858,
      "worst_variant": "py-optimized-all"
    },
    "greek_rel": {
      "current": 1e-06,
      "locked": false,
      "margin_high": null,
      "margin_low": null,
      "measured": 1.2430476230398562e-14,
      "oracle_error": 1.4322676295501878e-10,
      "proposed": null,
      "reason": "current value reaches the oracle error bound",
      "samples": 46858,
      "worst_variant": "py-optimized-all"
    },
    "iv_abs": {
      "current": 1e-08,
      "locked": false,
      "margin_high": null,
      "margin_low": null,
      "measured": 0.0,
      "oracle_error": 1e-08,
      "proposed": null,
      "reason": "current value reaches the oracle error bound",
      "samples": 46858,
      "worst_variant": "c-serial-inproc-warm-all"
    },
    "iv_ulp_rel": {
      "current": 1e-13,
      "locked": false,
      "margin_high": null,
      "margin_low": null,
      "measured": 0.0,
      "oracle_error": 1e-13,
      "proposed": null,
      "reason": "current value reaches the oracle error bound",
      "samples": 46858,
      "worst_variant": "c-serial-inproc-warm-all"
    },
    "price_rel": {
      "current": 1e-12,
      "locked": false,
      "margin_high": null,
      "margin_low": null,
      "measured": 0.0,
      "oracle_error": 5e-13,
      "proposed": null,
      "reason": "current value reaches the oracle error bound",
      "samples": 46858,
      "worst_variant": "c-serial-inproc-warm-all"
    },
    "provider_mid_diff": {
      "current": 0.005,
      "locked": false,
      "margin_high": null,
      "margin_low": null,
      "measured": null,
      "oracle_error": null,
      "proposed": null,
      "reason": "no recorded spread",
      "samples": 0,
      "worst_variant": null
    }
  },
  "project": "examples/option-pricing-benchmark",
  "protocol_sha256": "c46acc45cd49314a1843a96ee281d1de258e51cf69b5222754d33238941e9ecd",
  "schema_version": 1,
  "source": "optionlab.native_spread",
  "spread_sha256": "652e41c3338b2ee581e64027c0c9d9f68a6758698fd21522f3e39c44ed95f065",
  "status": "FAIL",
  "unproposed": [
    "alo.fit_nu",
    "alo.fit_rel",
    "alo.flat_vega",
    "alo.price_rel",
    "ambiguity_rel",
    "baw.fit_nu",
    "baw.fit_rel",